text,is_craft,best_preds
easi & fast friendship bracelet - simpl friendship bracelet tutori -,0,1
play with rope,0,1
just love halloween deco,0,1
color name with barbi doll,0,1
how to make cracker with paper | diy special paper cracker | mini crack,0,1
play doh learn color diy cute shoe cute babi milk bottl & ice cream for kid,0,1
i need to make 5 frame for canvas i bought onlin where do i start (pictur for refer on which frame i am talk about),0,1
arlo netgear login | +1-888-352-3810 | arlo sign in,0,1
wonder flower of paper basket (5),0,1
i made all these accessori how is it,0,1
found an old denim shirt and mark it up,0,1
how to make a work mini water well,0,1
a first attempt at someth crafti,0,1
how to make a pen holder with paper | origami pen holder | paper pen holder,0,1
creativ patch,0,1
custom paint a hip hop theme night stand here the top mac miller cover art inspir,0,1
i turn my exgirlfriend old winter hat into thi beauti jewelri box,0,1
diy jibbitz ha anyon tri make their own jibbitz i found the back on etsi but im wonder what would be the best materi to actual make the charm out of i thought polym clay but im afraid theyll break sinc it is a shoe,0,1
best way to hang stain glass im tri to creat a stain glass aspen tree and i dont want the piec mount to singl structur i want the piec to be hang and potenti hang from three differ arc structur to creat depth i wa think about wrap each piec with wire or rope to hang but i want to reach out and see if anyon ha ani experi with thi and could suggest ani idea,0,1
ua de halloween,0,1
my first epoxi resin lamp the other day i final got around to make someth out of epoxi resin here is what the final result look like :) [epoxi resin lamp](https://ireddit/94httctad5r31jpg) if you are tri to make someth like thi on your own check out thi site [https://howtoepoxyresincom](https://howtoepoxyresincom/) there wa a lot of use inform that help me out,0,1
jewelri pendant made from wood and epoxi resin,0,1
diy christma gift idea | new last minut christma gift idea | christma gift idea 2019,0,1
how to choos a name for your babi name challeng for babi,0,1
paper art work design by my sister,0,1
creat a paludarium for newt,0,1
giant halloween spider,0,1
diy dollar tree fall farmhous decor 2019,0,1
what did you do with the eggshel of wast just thrown it away im not ;),0,1
i made toy freddi into a origami bookmark,0,1
what did you do with the eggshel of wast just thrown it away im not ;),0,1
winter cover for vine zone 3-4 i live in anchorag ak zone 3-4 today fall came and blew all the leav onto the grass it is wet i plan on mow first break and i would like to use thi mulch to cover my plant to protect them from the cold will thi type mix decompos or will the grass just turn to goo should i just stick with leav onli,0,1
i made a fall wreath,0,1
how to diy antiqu light for cheap,0,1
a classi telephon i made for school (i know it not the best :/),0,1
homemad halloween decor,0,1
diy halloween potion charm just use atou bottl resin glitter and ink up now on my etsi should i make a video,0,1
how to make mini pond fountain from brick diy fountain,0,1
diy heart wall hang | diy newspap craft idea 2019| newspap wall,0,1
quilt squar creativ mess about and lot of epoxi --- have fun in the shop,0,1
how to make a beauti flower with paper | diy paper flower | make paper flower step by step,0,1
my sister love art,0,1
how to make a paper boat like and subscrib,0,1
hello friend ive made such a friend,0,1
i made magnet kid play block &#x200b; https://ireddit/9zfar0ri09q31jpg,0,1
idea with jute rope/hom decor handmad,0,1
"help me attach lace/embroidery/imag to athlet top i would like to creat the visual of lace on the front of a crop top for a costum * here is the [origin charact and outfit inspiration](https://images-wixmp-ed30a86b8c4ca887773594c2wixmpcom/f/783b9a46-3385-4b55-bb9c-3738fe8b3025/dd594ol-5a1fd383-893c-4d42-9ecc-e977bd39e220jpg/v1/fill/w_979h_816q_70strp/presant_bo_peep_portrait_by_alvaxerox_dd594ol-prejpgtoken=eyj0exaioijkv1qilcjhbgcioijiuzi1nij9eyjzdwiioij1cm46yxbwojdlmgqxodg5odiynjqznznhnwywzdqxnwvhmgqynmuwiiwiaxnzijoidxjuomfwcdo3ztbkmtg4otgymjy0mzczytvmmgq0mtvlytbkmjzlmcisim9iaii6w1t7imhlawdodci6ijw9odmziiwicgf0aci6ilwvzlwvnzgzyjlhndytmzm4ns00yju1lwjiowmtmzczogzlogizmdi1xc9kzdu5ng9sltvhmwzkmzgzltg5m2mtngq0mi05zwnjlwu5nzdizdm5ztiymc5qcgcilcj3awr0aci6ijw9mtawmcj9xv0simf1zci6wyj1cm46c2vydmljztppbwfnzs5vcgvyyxrpb25zil19qqj241br_dspiipqfjuagtygtwyygiihachdapn9ife) i am plan on run in the costum i make so im do an ""athleisure"" interpret * here is a [close-up of the lace pattern](https://s3amazonawscom/spoonflower/public/design_thumbnails/0904/9502/bo_peep_pattern_lace_blue_2_150-01_shop_thumbpng) * [here is my crop top](https://wwwoutdoorvoicescom/products/athena-cropvariant=12398439104590) in lilac it is made of 86% polyest 14% spandex how would you go about creat the look of lace/embroideri onto the athlet top idea i have: * iron-on (how would i go about thi is there a websit that offer custom laser-cut iron-on and i could iron it on myself) * puffi paint (seem too detail and id mess up) * sew lace into top (i love thi idea but i am have troubl find the lace by itself - it mostli [embroideri alreadi sewn onto a fabric](https://wwwetsycom/listing/710221822/bo-peep-cosplay-costume-toy-story-4gpla=1&gao=1&&utm_source=google&utm_medium=cpc&utm_campaign=shopping_us_d-accessories-patches_and_pins-patches&utm_custom1=0b6b1151-944b-4096-93f0-0e1542ee186c&utm_content=go_1844702574_68645527134_346397601067_pla-355215097388_c__710221822&gclid=eaiaiqobchmisznp8op95aivev8nch38dqyheaqyasabegkozpd_bwe)) * sew a panel of embroideri or print lace pattern onto top",0,1
how do i approach ad artwork to a guitar bodi that ha an acryl finish my dad is work on a guitar gift for a singer friend and ask me to do the art (mostli becaus he unwil to pay a professional) i am an experienc artist but im find thi not to be veri simpl i thought hed had just a base coat put on an unfinish bodi but instead he just bought a guitar with a fulli finish acryl seal in the color he want not a great start but im wonder if thi is still someth i can work out he just want a simpl leaf pattern paint on the edg of the face that we can then finish to protect it is there a way to do thi over the acryl finish and have it work and not look like shit or is he ask too much i worri about strip the finish (if that even possible) becaus it could destroy the color and ive got no experi do that or put a new finish over the art im curiou what option (paint decal etc) are there to get thi artwork on the guitar the way he want it,0,1
easi & fast friendship bracelet - simpl friendship bracelet tutori -,0,1
make a home made pizza for one,0,1
paper skull mask,0,1
amaz mini bbq - diy mini bbbq grill,0,1
they didnt make a playhous that i like so i grab a piec of paper and drew one then commenc build it,0,1
diy craft idea with coffe cup | how to reus dispos coffe cup hack,0,1
diy craft idea with coffe cup | how to reus dispos coffe cup,0,1
magnet ball creation diy make movi theater from 40000 magnet,0,1
21 mysteri of earth goddess earth goddess name,0,1
white ring left in quartz after leav a wet paper towel under soap dispens cant get it out ani suggest pleas help,0,1
how to: creat a univers,0,1
onli crazi crazi tiktok staff collect,0,1
how to make a sir fetchd plushi [free pattern],0,1
new fish 2019 amaz fish catch fish by palm tree on season dri,0,1
diy craft idea with coffe cup | how to reus dispos coffe cup hack,0,1
if you are look for new decor idea for christma check out my new video - 30 dollar store christma decor idea 2019,0,1
amazingus color paper make a wallmat 2019*exclus wallmat design 2019jannati craft,0,1
candi tin to keep tobacco from gather in your purs and your smoke from get crush,0,1
how to make a mini house(model) #1 - concret foundat,0,1
thought on thi,0,1
my son just got into pokemon so i made him a littl arena for hi battl,0,1
diy daisi chain bracelet (tutorial),0,1
suadeex work shoe,0,1
help glu rubber fist to mirror for an art show by tomorrow night hello i am an artist tri to get a sculptur readi for an art show tomorrow night the sculptur is a tattoo fist that wa origin sold for person erot use i think it is made of silicon or rubber i am tri to glue the bottom of it to a horizont mirror base i have alreadi tri silicon caulk and white adhes caulk and neither have work it either peel right off or the caulk will not dri i need to firmli affix it by tomorrow so i am look for glue that can be purchas from a brick and mortar store and prefer will cure within 24 hour it doe not need to be body/food safe as the piec is onli decor thank you for your help,0,1
just love it,0,1
my bag collect 2019 my collect of bag - handbag storag - how to,0,1
how to make vase out of wast newspap |newspap flower vase diy newsp,0,1
diy father day greet card idea 2019 | handmad father day card |,0,1
easi & fast friendship bracelet - simpl friendship bracelet tutori -,0,1
diy amaz mini waterfal fountain from brick & pvc,0,1
4 creativ idea wt tic tac,0,1
my mom made these pin holder hat and they so amaz and cute,0,1
how to make kinet sand heart | kinet sand cut,0,1
diy wicker basket with jute rope and cardboard | jute rope basket | jute weav,0,1
giant mandala mural,0,1
#halloween,0,1
i made a giant hello kitti doll | giant hello kitti pillow bed,0,1
i made some magic beach coaster with resin alcohol ink and sand from cape verd,0,1
( ) | | decor of chil,0,1
how to make diy easi woolen wall hang with old bangles//best out of wast bangl and wool craft,0,1
flower basket make at home/ room decor,0,1
tradit night fish by pacha and poli | carp fish | amag fishin,0,1
crochet hero of the legendari game who gue,0,1
how to design a tini hous [recommend design software],0,1
2 rose leav,0,1
i made a wine bottl time capsul for a friend wed,0,1
the bake of a rag quilt,0,1
a cute littl homemad wreath for autumn nearli all from my local parks/own back yard,0,1
coconut shell miniatur garden,0,1
super easi fall craft for 2019 1st in a short seri of craft for thi fall 3 simpl craft for the fall season thank,0,1
diy paper flower | how to make easi paper flower | paper flower make,0,1
pot fountain for $30,0,1
5 minut step by step friendship band | diy friendship simpl & easi ho,0,1
how to distress wood,0,1
hand-paint zombi head in resin necklac pendant these were made for codzombi but also work for halloween,0,1
make spider-man web shooter,0,1
inner bottl paint,0,1
3type paper boat make tutori that float | origami boat easi instru,0,1
how to make birthday card at home | diy birthday card,0,1
print beauti,0,1
make your own dog toy,0,1
be inspir and energet,0,1
the top 3 best book of how to make doll cloth diy craft | miss snowman artwork - miss snowman,0,1
i made a unicorn skull mask becaus halloween is come,0,1
i creat these love books: old school love with a new school touch for those who want to show their love in a more person way and celebr the littl thing most of my buyer are men that interest and cool becaus most men i am awar of are not primari gift giver,0,1
help with epoxi resin,0,1
i make leather bag what do you guy think about thi one it a bum bag i made for festiv,0,1
attract beauti ladi with opposit charact - latest 2019 no,0,1
carv handmad miniatur skateboard :),0,1
how to make real leaf art diy preserv real leaf,0,1
a beauti handmad necklac,0,1
the most effect method to enjoy the beauti,0,1
cleanest of beach of andaman & nicobar,0,1
loft kid bed - mine a project from two year ago for my cakeday,0,1
i made my first ever con costum today it technic doesnt count but i want to share,0,1
scarecrow wreath,0,1
my first crochet flower,0,1
amaz fruit decor art ideas|fruit art you need to tri,0,1
i convert a retir ambul into a tini home,0,1
context matter,0,1
i made thi art resin phone case let me know what you think https://youtube/zgiptpvp-5g,0,1
craft weekend rock,0,1
explos box tutori | birthday box| how to make explos box,0,1
diy cardboard cat tower,0,1
how to make a doll with complet wast materi,0,1
acryl paint i just paint,0,1
"look for ""paint magic"" by jocasta inn im look for instruct on fossilston marbl so would be grate if you could send me pix of the relev page in the book i use to have the book and it well out of print",0,1
found a hors skull bought a horn bam unicorn skull for display,0,1
i carv a wooden hors for my kid,0,1
made some resin fridg magnet / coaster use tape and laserjet print,0,1
diy room decor flower,0,1
how to set-up and use a dado stack - full tutori and exampl,0,1
i made thi walker for my daughter - ive creat a monster,0,1
my favorit tote bag made thi for a friend,0,1
work progress sottobicchieri con stecchini di legno,0,1
i start to tri it,0,1
my new watch,0,1
hi you anyon know where i could buy thi it look beauti,0,1
25 dollar buffet updat from michael clearanc item,0,1
i got a free popsocket but it had a logo on it alreadi so i decid to be creativ i hope bob ross would appreci thi,0,1
i final finish a doll bed for my littl one,0,1
i made a wine bottl time capsul for a friend wed,0,1
how to make a fidget spinner without a bear fidget spinner how to make,0,1
where can i buy differ size corrug box for exampl i need some that are 12x10x8 (approximately) i see amazon sell box in mani size but onli in huge packag (25 boxes) where els sell a larg varieti of size would michael or a craft store thank,0,1
[help] combin a rotisseri motor and lazi susan hey yall im tri to make a giant stuf bear on a surfboard (long story) spin in a circl so far im think my best bet would be to combin a lazi susan and a rotisseri motor i figur out the how but my question is if the rotisseri motor ha a load bear of 25 pound would the addit of the lazi susan help to increas the potenti load bear in my head it should but ive also never done thi befor if you have ani other suggest let me know for how to do thi pleas feel free to throw out suggest im desper :/ my best estim is that the bear on the surfboard will be anywher from 40-70 pound and im tri to make it spin at about 1-ish rpm in a circl with a 25 foot radiu,0,1
basic tutori for a set of leather larp bracer,0,1
i redid thi old thrift store cart,0,1
thi nature-inspir potteri will hypnot you,0,1
foot paint idea for kids: butterfli honeybe and ladybug,0,1
hand paint idea for kid - tree butterfli and caterpillar,0,1
i took advantag of the school laser cutter,0,1
cast a spider in resin,0,1
recreat $1700 worth of decor for onli $63,0,1
first attempt at bookbinding- handmad leather bound journal (detail in comments),0,1
my creatur from the black lagoon theme arcad machin,0,1
rc boat make,0,1
i finali made myself reddit sticker on the cricut,0,1
red oak jewelri box for my wife,0,1
life hack,0,1
recommend for best paint for paint extern brickwork pleas after over a decad in our hous we final had some work done to the garden to turn it from a concret jungl into a love lawn suitabl for the children to play in the back of the hous is brickwork and wed like to paint it to give it a lift and would like recommend for the following: \- paint colour: were think white but mayb that get stain too easili \- paints: which uk brand is recommend over other wed like someth that last as im not one for paint it everi year im in the uk thank you,0,1
diy paper flower wall hang,0,1
bought a vintag breadbox at a garag sale for a dollar i wa bore at work and decid to refinish it,0,1
ring made from an 1862 silver rupe coin here how,0,1
safest way to polish thi porcelain teapot more detail below,0,1
how to make cute name tag for gift school etc,0,1
"he invit pm bori johnson to ""leav hi city"" and becom a hero",0,1
pleas inspir me how would you paint thi doll hous,0,1
tutori for a paper heart chain diy from magazin 3d paper heart,0,1
i made some magic beach coaster with resin alcohol ink and sand from cape verd,0,1
thi is how you make soap at home and the scienc behind it have you ever tri thi,0,1
first time paint a sugar skull all materi from the dollar tree,0,1
how to - make a simpl home/offic wall decor cardboard craft,0,1
repaint my pergola,0,1
lego sock,0,1
"cross section finish advic hello all im attempt a somewhat last minut gift for my wife im take a ~1"" thick cross section of tree and turn it into a clock my plan is to sand the rough cut smooth burn number into the face and instal an analog clock mechan as for finish i wa look at a pour-on (envirotex lite unless there are better suggestions) in hope to make thing easi on myself and preserv the bark around the edg would i be abl to use thi or similar and just pour over the top and let it run over the side of the piec i enjoy woodwork but have never enjoy the finish phase i am also concern that ani normal brush or wipe on product will soak into the grain unevenli im work on thi project when i can after work hour and ive onli got a few day left so ani advic would be immens appreci i apolog if thi ha been ask befor ive been search through past post but havent seen what im look for thank you",0,1
plain white to glitter(y) rose quartz #diycraft #vinylcraft #self-adhes #stahlsclear,0,1
how me and a friend creat someth to make sure you have the best toilet visit at our offic,0,1
happi teacher day statu // #happi #teacher #day,0,1
littl dandelion ornament,0,1
https://youtube/g9ulews0rgc,0,1
handmad from color metal wire,0,1
fractal wood burn with paint,0,1
over 80 anim recreat spongebob icon first episod help want in thi amaz reanim collabor plus: band geek episod from 140+ anim come soon,0,1
wow 6 amaz life hack with drill machin,0,1
wow 6 amaz life hack with drill machine- https://youtube/84j4rcorlk,0,1
diaper cake i make for my expect friend,0,1
the eagl from screw attack the hamster how to make a golden eagl from screw | diy craft,0,1
larg scale art print are expens so i bought a blank canva and diy- with some acryl paint so happi with how it turn out,0,1
make fake milk im work on someth that requir some fake milk for practic sake id like it to be solid so the first thing i thought of wa some epoxi with white pigment or some white paint im probabl go to need close to 64oz and wa wonder if anyon had ani better idea befor i got start thank,0,1
with rich style and exclus design these decor product perfect to enhanc everi corner of home,0,1
pictur creat with sand you turn around the pictur and creat art,0,1
my master bath remodel i post thi a while back but thought i might be abl to get some better feedback here,0,1
mid-centuri modern loung chair hello today i want to share the process of creat a mid-centuri modern loung chair it all start with a model in sketchup &#x200b; https://ireddit/l36qs3u7n7k31jpg then he start to make a seat &#x200b; https://ireddit/n8px2zn8n7k31jpg and the back all assembl on a mortis and tenon connect &#x200b; https://ireddit/vgcrswe9n7k31jpg first look &#x200b; https://ireddit/e68ppc6an7k31jpg then from the scrap i began to pick up a templat for the leg the seat ha been rais to the properli height &#x200b; https://ireddit/ewbnqruan7k31jpg leg &#x200b; https://ireddit/iexr7xebn7k31jpg next were ad the structur element &#x200b; https://ireddit/3xvvfk7cn7k31jpg glu all part togeth &#x200b; https://ireddit/v8vjj65dn7k31jpg cushion are also made by hand from dens foam rubber the fabric wa select in contrast to the pinkish color of beech https://ireddit/b7wj8ovdn7k31jpg &#x200b; https://ireddit/j51tufwen7k31jpg materials: \- beech \- oak and mapl for insert on the back \- water-bas matt polyurethan varnish for topcoat &#x200b; instagram: [https://wwwinstagramcom/nikolayshorygin/](https://wwwinstagramcom/nikolayshorygin/),0,1
photo frame diy idea how to make easi photo easi paper craft,0,1
time-laps of carv a celtic tree of life in stone,0,1
match chain reaction egypt pyramid amaz fire domino,0,1
order valiumoxycodon oxycotin percocert mandrax adder dilaudid roxycodon painkil without prescript required: sms/call:- +1(614) 681-0447,0,1
how to make fashion bracelet - diy gift craft - bracelet tutori,0,1
pokemon detect pikachu bulbasaur polym clay sculptur - super cute ()*:,0,1
starri night in cork it took about 5 month to make becaus i had to collect all the cork from my drunk friend and famili and i could onli work at night 70 x 100 cm,0,1
here is a coffe mug i finger paint a galaxi on lol,0,1
tri to make a bottl rocket out of a 2 liter soda bottl,0,1
nake girl,0,1
last year my son and i made an interact pumpkin for hi school contest meet pumpkinstein,0,1
i made an escap room button puzzl would you tri it,0,1
slime with honey and eggsno glue no borax,0,1
i made a spoon,0,1
hydro dip my mechan keyboard what do u guy think,0,1
how to make a mini toy car diy,0,1
my geek bracelet it handmad do you like it,0,1
epoxi and wood lunar surfac night light,0,1
lamin (or protecting) map for wall hang (4 x 5),0,1
i made a workshop stool out of old hex nut pick at the local junkyard and i film it,0,1
made these studio ghibli no face ear (spirit away),0,1
kid wall sticker anim - giraff height wall sticker for bedroom,0,1
how do i fix my t-shirt collar,0,1
diy: recycl cd wall decor,0,1
i-transf coating: hpm-37 normal metal mug oki print laser transf,0,1
lumpi wool pillow rescu with on hand materi,0,1
surfit resin stud ear,0,1
easi & beauti wall hang with wool and cardboard | amaz home decor idea | som happi craft,0,1
design birthday cake with all flavour,0,1
i ju love to make peopl laugh and entertain them so they can feel like themselv while watch my channel pleas subscrib to the #naemob i would love to have you let grow togeth,0,1
how to turn your beard into forki for halloween,0,1
chack you can step on popsicl stick mini chair,0,1
i made a four-pictur frame with an etch pattern on the front,0,1
here how to make a distil from 2 beertend ^^ love it,0,1
cake made more fun with biscuit - teemey,0,1
best reus of ice cream stick - how to make ice cream stick craft idea,0,1
pure wooden sun glass,0,1
good base for a deer skull mask i want to make a mask that kind of like a deer skull but im not sure what to use for a kind of skeleton so it doesnt collaps im use cardboard that ha been boil and broken down mix with wallpap glue to make a kind of clay but i cant just make the horn with that or it might collaps if you want to see what it look like just look up wraith hallow blight and youll know what it is when you see it i dont have a huge budget so just tri not to suggest anyth super expens,0,1
how to make a water on diorama,0,1
find top 5 design cake,0,1
chocol cake for kid,0,1
mini basketbal from cardboard,0,1
my dad and i finish our patio today,0,1
my dad and i finish thi patio today,0,1
how to make a polym clay flower tutori easi for kid,0,1
how to make a damascu mini dagger,0,1
how to make resin lamp,0,1
tree of life hang pendant,0,1
my granit is perman stain from wateri dish soap,0,1
idea on for a birthday present use a photograph,0,1
a craft show jewelri display i made with scrap wood dowel and some cork cost me almost noth,0,1
plant pot,0,1
craft paper flower tutori | paper flower | diy | decor idea | no20,0,1
paint my jean,0,1
love my herman miller aeron but the mesh is too slipperi so i slide into a slouch how could i make it more grippi,0,1
m&t store,0,1
new tri red goldfish transpar key cap hope to have a favorit friend,0,1
our diy wed guest book a halv log with resin fill knot the nicest project ive done to date,0,1
trash bag gown made by me entir from hefti bag & 1 hula hoop with coordin banana peel head dress,0,1
how to make pen stand from wast materi,0,1
diy|easi pista shell craft,0,1
i paint thi,0,1
mirror ring make,0,1
how to make a deco mesh pumpkin - diy mesh pumpkin,0,1
progress on a ukulel im make for my boyfriend,0,1
indoor statu,0,1
comic book coffe tabl decoupag,0,1
how to make laddu gopal aasan janmashtami | how to make palki for janma,0,1
530 cardmak tutorial: anna griffin scallop edg angel christma card,0,1
|danc contest of princess |arabian fairi tale,0,1
13+ diy teacher christma gift for student,0,1
handmad fish bone shape bracelet,0,1
i made some rainbow flower,0,1
how to make a person greet card for a love one- with person art,0,1
look what i made: plant in a jar,0,1
antiqu - world navig chart,0,1
the art of beauti in form of makeup,0,1
custom friendship bracelet for sale :),0,1
how to make paper ball ornament,0,1
craft stapl to make spectacular diy halloween decor,0,1
how to use lavend oil for hair growth,0,1
do it your self connect the dot t-shirt by fernando sez x riccetti cloth,0,1
neo blyth fanifaniflamingo flamingo blyth unbox,0,1
first time make anyth like thi (not finished) what do you think so far,0,1
