text,is_craft,best_preds
releas a 2 part plaster mold im sure the answer to thi is out there somewher but i cant seem to find it im make a 2 piec mold to cast wolf wax (machin wax) posit for cast in 1 piec invest powder mold via a burnout i have a bag of plaster of pari that im attempt to use to make a master with to save myself 50$ invest powder isnt cheap thi isnt by first time make mold of variou materi and im familiar with all but one problem here what im about to describ is by no mean the proper way to do thi with plaster so input there is also appreci if there is an easier or more correct way ive done some small scale test with a section of cure plaster i appli an oil that i felt wa of the right consist not to absorb too deepli (veget oil) to the mate surfac i then pour freshli mix plaster onto it ive done thi befor without oil and notic that plaster tend to natur seper along a line where 2 differ batch were pour after the first wa cure in thi test they did seper as such but a coupl piec seem to push the oil out of the way (along the edg and directli in the center where it wa poured) and these area bit hard enough to worri me on a larg scale (2 sq/ft) mold even if small area bite on that size of mold thi can quickli becom a problem is there someth that work better to allow them to releas while not soak into the pour is thi complet wrong and i should be use anoth method entir to be clear im not cast with a metal posit and my problem isnt get the master pattern to releas from the plaster it in get the plaster halv to releas from themselv after pour the second half i have use some other materi such as corn starch and even mold releas which i typic use in my silicon 2 part mold to the same effect mayb it my coverag and im miss spot or mayb the lil are bead up dure the few minut where im mix i dont know what the heck is everyon do to get 2 halv of plaster to seper,0,1
how to tie necklac slipknot,0,1
my wife made a super cute gator babi rattl for our littl one that come in januari,0,1
i built a tardi littl free librari - just in time for school year,0,1
can you glue a design from an old shirt onto a new shirt sooo my husband ha thi shirt he love he worn it for like 10 year and it worn out it unwear i thought of make it a patch and sew it onto anoth shirt but it so thin it wont last long i wa wonder if i could cut out the design part and just fabric glue it onto a new shirt i want it to last a while anybodi got ani experi or tip,0,1
diy card idea,0,1
i made a joker figurin,0,1
mal as ruler of underworld#alic creat,0,1
im make a bracelet with flower i will post it finish,0,1
i made a meteorit wine barrel and tungsten wed ring,0,1
"i made marvel ""spider ham"" figur out of air-dri clay",0,1
leisur season eisur season sb6024 wooden backyard,0,1
how to make beauti rakhi at home | diy friendship bracelet| rakhi mak,0,1
easi diy home decor | wall hang with wast bangl and wool | reus idea | som happi craft,0,1
flower pot - diy organ of jute and cardboard,0,1
independenceday special 2019|tricolor crepe streamer paper garland tutor,0,1
never tri make my own cosplay outfit until today day one of my nightingal armor,0,1
neato idea for work/school binder i bought a pack of assort sticki note then use the tm mount squar to put them on i keep my work receipt in the bottom pocket,0,1
my atat made from lasercut wooden piec,0,1
babi utensil gift,0,1
gift for sister,0,1
easi diy rakhi in 5 minut | rakhi make idea for school competit | r,0,1
match chain reaction amaz fire domino,0,1
i made a mailbox,0,1
believ i expos myself to asbesto not sure what to do next,0,1
angl control on the guid system,1,0
pintinho do tema galinha pintadinha,1,0
tmmeememememmeemememmeememmeememmgnejhhjhhhnhhqnqyggfffhffffffffrhghfa,1,0
that me,1,0
found thi manti drown in a bucket of water pin dri and immort her in copper (bi electroplating) for a necklac,1,0
build a delorean out of cardboard,1,0
foout the hobgoblin,1,0
made thiz,1,0
check it out (:,1,0
bojack horseman,1,0
just post my first video ! thi is how to make fantasi armour out of foam thi is great for renaiss fair halloween or convent,1,0
abod 2019,1,0
i turn the undersid of our dine tabl into an outer space fort for my 4 year old son,1,0
checker board and croc,1,0
inktob 2019 day 5 build (owen and theo build with lego ! ),1,0
bunge cord shelf | how to | organ build,1,0
tiny-world bottl open,1,0
sealant crafter of reddit my mother is like for a waterproof sealant for plastic she make keychain and zipper pull and would to somehow water proof them ? ani idea ? tia,1,0
what do you guy think ? just gotta add some water,1,0
help with an enamel mug i recent purchas thi mug from amazon [https://wwwamazoncom/gp/product/b00r3xz4da/ref=ppx\_yo\_dt\_b\_asin\_title\_o01\_s00 ? ie=utf8&psc=1](https://wwwamazoncom/gp/product/b00r3xz4da/ref=ppx_yo_dt_b_asin_title_o01_s00 ? ie=utf8&psc=1) as mani of the comment suggest the graphic almost look like sticker and i do not anticip the graphic hold up onc i begin frequent use with the mug im not sure how to fix thi in order to ensur the graphic will remain and the mug will be food safe my plan wa to spray some kind of enamel clear spray where the graphic are present doe anyon have similar experi work with enamel mug or techniqu suggest ?,1,0
my first restor video of an old and rusti axe 100% enjoy :),1,0
belajar hewan liar untuk anak-anak - mainan binatang untuk anak anak,1,0
daria,1,0
done,1,0
como deixar os enfeit em p ? melhor tcnica/seguro e fcil,1,0
action is the foundat key to all success - pablo picasso,1,0
diy how to make pumpkin,1,0
amaz diy led lamp with glue stick and led tape light,1,0
como hacer un dinosaurio rex con papel,1,0
look for idea what would you guy do with thi old wood stove door that i am restor ?,1,0
tabl in loft style,1,0
i love brick ! here is what i built,1,0
how to fix that rip ?,1,0
how to build a move and height adjust comput desk hello i am look to build a comput desk that: * is height adjust so i can lower and rais it accord to my need * ha tire so i can move the desk easili from one room to anoth * ha a monitor mount arm or at least support the weight of an extern monitor i have a curv 24 inch extern monitor that i want to mount i prefer mount on an arm instead of just put it on the desk becaus mount make the monitor sturdier and wont wobbl or move a lot when the desk itself is move * ha some nice tube for cabl manag i just want you guy to point me in the right direct i have never done ani diy work in my life so i am inexperienc but i am will to follow a tutori or a guid or look at a blueprint and take my time work on the project i am not in a hurri even if it take more than a month thank in advanc,1,0
diy hack super afford easi ! 2019,1,0
how to make a mobil charger stand | jute mobil charger stand,1,0
hand made and repurpos hoodi,1,0
wearabl art - unconvent materials- need inspir ! im tri to challeng myself similar to the challeng on project runway where they make a look from unconvent materi anyon want to throw out idea of place to hit or materi that could be reclaim for such an endeavor ? hardwar store and candi store are some place the show ha done and hardwar store definit ha thing id be intrigu to work with but even better if you have idea for use reclaim materi that dont have to be purchas as i definit dont have tv show budget lol,1,0
girlfriend like purpl so i made thi for our bedroom,1,0
make googl slide i want to tri to make googl slide ( slides/sand with the googl slide logo on the strap) ani tip on get an authent look ?,1,0
bro,1,0
iqo hacking/reverse-eengen,1,0
woodturn a lid appl wood box,1,0
1st time give a workshop too cheap or just right for pilot ?,1,0
bojack horseman,1,0
2 2,1,0
forgot a befor but thi is the after ! found in my brother basement strip sand repaint and stain,1,0
i need help what should i make with thi,1,0
balloon life hack you should know,1,0
nephew first bday theme is where the wild thing are and i made these frame for the polaroid station,1,0
my beard help hamm get hi cork back in !,1,0
help ! ! ! ! with my kickstart campaign ! ! !,1,0
the diver,1,0
how to make the epoxi tabl and concret ?,1,0
how to make plaster of pari - how to make plaster - how to make plaster,1,0
open-fac tomato sandwich with basil,1,0
build a stasi chamber for film/theat,1,0
dont know whi im into resin thi much,1,0
teahous,1,0
custom made dog har old small vs new larger size !,1,0
build a lego pikachu from scratch,1,0
restor of an old chair,1,0
kermit,1,0
reason for background remov servic,1,0
advic on what paint/primer/seal work best on a wood composit box [thi wa my first beginn here so pleas forgiv me of my lack of knowledg on avail product last week i made thi for my brother wed and use the following: -artmind primer -decoart americana decor matt metal (in the 8 oz canister) -royal &amp; langnickel 25 piec brush set that were approv for acryl long stori short the primer seem ok howev the paint wa the bane of my exist no exagger i wa paint layer from 1 pm-3am and as you can see in the imag there still streak uneven etc i dont know where i went wrong wa it the primer ? is there a better type of paint to use on wood composit than acryl ? wa it the brush ? unfortun i didnt have time to seal thi but i did use seal spray on plastic frame befor and seem to do the trick but im tri to find one best for thi type of craft/best even coverag potenti not a spray ? im make a second one for a friend and want to majorli improv it will be a matt navi blue tip on brand or specif product ? ! ninja edit: i did sand prior to prime with veri fine sand paper !,1,0
clifford,1,0
built a littl stool use my old car part lay around in the garag,1,0
i built thi drone from a cherri pepsi box (minu the electronics),1,0
rc rock crawler full upgrad | hb p1803 24ghz 1:18 4wd off road car,1,0
"made three enemi today the one on the far left is ""red brick golem"" center is ""red brick knight"" right one ""red brick gurad""",1,0
part one | steampunk ga mask | paint job,1,0
can someon pleas direct me to a video or tell me how to do thi ? ? i want to know how to be abl to make it elast at the top i know how to do the fring though anyth would help :(,1,0
must have tool for a beginn woodworker/diy,1,0
hvac mastic ? hello all ha anyon ever use hvac mastic sealant for ani type of craft work ? i do a lot of build for my wife school build display for book fair etc my latest is a larg igloo made from cardboard and mastic seem like an easi way to beef up the interior wall and possibl the outer wall seem like mastic would also work well for tree trunk or other rough textur surfac while ad durabl the mastic is water base and doesnt seem to be overli toxic while dri especi consid it usual use for ac duct that push air around build,1,0
diy how to make a toy excav use a magnet ball,1,0
lamp spray paint regret-how to fix ?,1,0
best way to learn japanese: 7 best way to learn japanes,1,0
you need to make these right angl clamp jig !,1,0
- : -,1,0
make my own electr guitar need advic hey so im plan a build of my own electr guitar i have most bit i need but im struggl to find where to get decent qualiti wood in the size i would need googl suggest ebay but all i found were either tini pieces/block or veneer im in the uk so if ani of you know ani store or way i can get decent wood reason cheap then thatd be great im not too fussi about what kind of wood it is but it need to be at least 2 inch thick i can onli find like 06mm thick veneer thank in advanc guy,1,0
idea to makeov these kitchen chair ?,1,0
ani idea on what materi i would need to recreat a paint like thi ?,1,0
when you dont have a dri rack,1,0
reclaim a wood desk and easi drawer build,1,0
decoupag tabletop sealer ? hi everyon ! i have a tabl top that ive done a decoupag collag on and ive alreadi seal it with polycryl the polycryl is give it a nice coat but im still get some bump and ridg where the imag overlap what can i appli to give the tabl top a clear flat surfac ? i know epoxi is an option but i wa hope to avoid that would a clear brush on lacquer achiev the same result ?,1,0
"""and in the end is that not what man ha dreamt of sinc first he look up at the star ? "" my 16x32 paint is complet and readi for it new home",1,0
i made a drd from farscap,1,0
home,1,0
chloe,1,0
ecofriendli,1,0
houston hypnotherapi train hypnosi certif houston texa,1,0
with my besti,1,0
how can i put a dowel through the center of a foam ball ? im make a homemad globe out of a foam ball with papermach over it i need to put a rod or dowel of some sort right through the exactish center both so i can orient the globe correctli and so i can mount it ani idea ?,1,0
mark 1 arc reactor build kit from mando studio,1,0
look on way to make the red more of a darker wine red im veri artsy/crafti but look for ways/stuff to use on it to make the red darker my whole car is wine red so thi shade wont work i dont want the h elev by put stuff on top id still like the gloss to shine like the restthx,1,0
what you can find in d workshop,1,0
? | | #61,1,0
the ide for the ro squr !,1,0
repair wall with a 3d pen | 3d pen creation | 2,1,0
i made it myself,1,0
decod from unchart 3,1,0
how can i fix mold relat epoxi imperfect like thi ?,1,0
wooden doubl door fit full process | door fit by skill craftsman | woodwork in bd,1,0
"i made thi greninja ""midnight swamp"" pokebal",1,0
natur beauti product i made for my mom,1,0
hi all doe anybodi know of ani male crafter that i can follow on youtub or onlin,1,0
i made a tabl to organ my art suppli out of an old coca-cola tray and some tabl leg ! !,1,0
amaz what can be done with a broken harley shifter found in the gutter,1,0
i made my car magazin collect into a coffe tabl,1,0
the terror of mechagodzilla !,1,0
ahahahahhahah restorant,1,0
diy podium,1,0
i need your help ! it not exactli craft but i feel like someon might be abl to help i put my good beani in the wash the other day and it ha come out look like thi befor it wa a big thick fluffi beani but it ha come out extrem thin and out of shape,1,0
!,1,0
"proofread me on make of a boombox i decid to get myself into electron and mayb audio stuff so i decid to make myself a boombox just becaus i can and mayb sell it afterward due to lack of use i just never mess with audio and act by whatev guid i found on (your favourit search engine) and not realli confid on what i need there what im plan to do: invad aliexpress for suitcas amp speaker some electron and whatnot and clob it togeth with mad skillz and hire an artist to draw a yellowjacket face on front i want to make it to the best of my ability(and draw is horrend that whi ill outsorc it) features: at least 24h of ""parti time"" bluetooth full rang audio(mor below) volume/bass/trebbl control 12v power socket robust 220v(like in pc cases) batteri charg indic metal grill so nobodi poke a hole in my speaker what i came up with speakers: 2\*15 10w tweeter 2\*3"" 20w full rang 2\*4"" 15w woofer and 525"" 50w subwoof all arrang [about like gray box is the side of the suitcase( 37x285x8 cm so the board is \~35x27 cm) where speaker will be instal idea is to give full rang around and dedic tweeters/woof scoop where full rang miss and add to overal volum the amp board ha l and r channel 50w for each and 80w for subwoof so i guess im not exceed the budget in term of power might add simpl crossov to tweeter and other if need batteri will be ether a brick or two like those instal in upss or mani smaller batteri solder togeth all of that will be link to power control board that manag charg and give output for 12 and 5 volt bluetooth+next/prev/stop/play button will be provid by a board with arduino nano+wifi module+coupl of buttons(aliexpress sell thing like those that are readi to go out of the box) what do you think ? is it too overkil somewher ? miss someth ?",1,0
f*ck nugget !,1,0
how to make wall mount bottl open !,1,0
catasauru rex found the templat on thingvers and 3d print it then paint it,1,0
need to get rid of week old fabric spray on brick long stori short need to get fabric spray off brick that been dri and set in for the past week how can i do it ?,1,0
a potpourri bag i just made smell good and look good,1,0
here to you,1,0
one more,1,0
i made these wooden headphon stand for seriou retro game lover i hope you like them,1,0
new project shelv white stain first then sand a littl and add light coat of darker stain over it will post updat steel pipe bracket,1,0
the best idea of use old metal !,1,0
led tester diy,1,0
space,1,0
my necklac broke how do i fix it ? basic the problem is attach a small metal ring to anoth flat metal surfac (pictur prefer easi to obtain product but number one prioriti is for it to hold togeth thank you in advanc for ani help !,1,0
artifici plant wall,1,0
chip food truck nobodi want to help me get a real on so i made myself a paper one,1,0
i etch some acryl for a led light,1,0
studio softbox from ikea floor lamp,1,0
my dinosaur team,1,0
race car liveri on cornhol set,1,0
inexpens diy bridesmaid box i made for my besti get marri ! (link to album in comments),1,0
best offic gadget you need to see | desk & offic idea !,1,0
coffe slime,1,0
help with a costum,1,0
heeelp meeee,1,0
help ! doe anybodi know what thi is call ?,1,0
homemad patr o t squr,1,0
ufo in my home ! i need agent mulder and sculli ! ! )),1,0
homemad iron man arc reactor,1,0
advic ?,1,0
i made a krusti mosiac !,1,0
cant afford to spend >$200 on sold out jojo bizarr adventur van so i made myself a pair for less than $20 ! (album in comments),1,0
anyon know a safe way to cover thi piec without damag it current cover ?,1,0
funcraft,1,0
wall shelf,1,0
it readi :d smartmirror out of old vga panel and raspberri pi3 | some idea what to do with thi ?,1,0
float pencil amazon alexa case,1,0
$5,1,0
how to make a diy revers hood dress,1,0
diy guy jean to cuf short transform,1,0
my dog at home #woodcraft #wood #pointer,1,0
homemad wooden outdoor ashtray,1,0
comput model | comput model project,1,0
help me turn squiggl into mountain ! how can i make thi wall mural look lessbad & more like a mountain scape,1,0
1940 brace drill restor / free tool restor seri ep2,1,0
(funny) i restor an 80 era youtub machin still work great diy link in comment,1,0
diy live edg slab float shelv,1,0
ocean epoxi tabl my mom made,1,0
3 easi balloon garland idea,1,0
a desk i built for my beauti girlfriend !,1,0
insid a mr meeseek box i have made,1,0
"the branch that fell from our river birch tree coupl of year ago now support the potho to climb i scrape sand and warnish it to bring it back to ""life""",1,0
what type of vinyl is thi ?,1,0
my iter of bt from kpop btham :d,1,0
bed with storag,1,0
ddddd aaaaaaaaaaaaaaaaaaaaaaaaaaaadm,1,0
ani crafter have idea on person basebal bat ? hey all i make basebal bat on my lath for local player and am tri to come up with the best way to add text to the barrel i am use decal for the logo on the handl but am not a fan of use them on the barrel i am look to either use some kind of metal stamp to give some depth or ink stamp to just have the text i am work with mapl or ash wood and have concern with keep the metal stamp line up so the text doesnt look like it is part of a ransom note and with use ink and a stamp pad i dont know how well thi work on a round surfac or if the paint/ink will be durabl enough for game use ani thought or direct would be awesom thank you,1,0
how to make a beauti house(model) #4 - electr wire and build a concret ceil,1,0
some papercut i made,1,0
made thi one while drink my morn coffe inspir by an 80 childhood (and black flag),1,0
shoe storag bench,1,0
need help locat hoop plate,1,0
i made a butterfly/be water,1,0
i made thi jumper !,1,0
how to build a custom toy box,1,0
how to make a diy concret past planter recycl styrofoam - by barbara din,1,0
squidi,1,0
build of my stand up jewelri cabinet,1,0
need help custom an insul koozi,1,0
frame for a mirror of wood trim,1,0
make an aladdin diy geni lamp,1,0
thi custom kitchen set is come along nice !,1,0
$2 at the flea market ive never seen anyth like it befor basic trace and cut fabric and put it in a foam board that had the batteri cut into it use a butter knife to tuck all the edg of each piec in fun project,1,0
a second life,1,0
